<?xml version="1.0" encoding="UTF-8"?>
<!ELEMENT projet (utilisateurs+)>
<!ELEMENT utilisateurs (email,password?,nom,prenom)>
<!ELEMENT email (#PCDATA)>
<!ELEMENT password (#PCDATA)>
<!ELEMENT nom (#PCDATA)>
<!ELEMENT prenom (#PCDATA)>